{
  "schema_version": "1.0",
  "rule_set_id": "nsysu-112-bachelor-B2040",
  "rule_type": "department",
  "entry_year": "112",
  "degree_level": "bachelor",
  "department_code": "B2040",
  "department_name_zh": "應用數學系",
  "department_name_en": null,
  "common_rule_ref": null,
  "review_status": "manual_review_required",
  "reviewed_at": "2026-08-22",
  "coverage": "partial",
  "credit_requirements": {
    "minimum_graduation_credits": 128,
    "minimum_required_credits": null,
    "minimum_elective_credits": null,
    "minimum_department_elective_credits": null,
    "minimum_department_professional_credits": null
  },
  "sources": [
    {
      "source_id": "official-required-subjects-112-b2040",
      "title": "國立中山大學必修科目表（112學年度入學新生適用）－應用數學系",
      "url": "https://selcrs.nsysu.edu.tw/stu_query/crs_mst_qry/crs_mst_query.asp?action=3&YY1=112&DPT1=B2040",
      "document_type": "html",
      "reviewed_at": "2026-08-22",
      "sha256": "09404ba410bab9c7d667c301be8e85d5ce2842db51f8cda50b7d708398ddd4a4"
    }
  ],
  "courses": [
    {
      "course_id": "b2040_2aaf9e0aaeee",
      "canonical_name_zh": "微積分(一)",
      "canonical_name_en": null,
      "known_aliases": [],
      "credits": 4.0,
      "curriculumRequirement": "department_core",
      "recommendedYear": 1,
      "recommendedSemester": "fall",
      "source_document": "official-required-subjects-112-b2040",
      "notes": [
        "官方必修科目表未提供英文課名，故不自行翻譯。"
      ],
      "alternatives": [],
      "manual_review_required": false
    },
    {
      "course_id": "b2040_88e1ffdd2e37",
      "canonical_name_zh": "線性代數(一)",
      "canonical_name_en": null,
      "known_aliases": [],
      "credits": 3.0,
      "curriculumRequirement": "department_core",
      "recommendedYear": 1,
      "recommendedSemester": "fall",
      "source_document": "official-required-subjects-112-b2040",
      "notes": [
        "官方必修科目表未提供英文課名，故不自行翻譯。"
      ],
      "alternatives": [],
      "manual_review_required": false
    },
    {
      "course_id": "b2040_8e139999a621",
      "canonical_name_zh": "數學導論(一)",
      "canonical_name_en": null,
      "known_aliases": [],
      "credits": 3.0,
      "curriculumRequirement": "department_core",
      "recommendedYear": 1,
      "recommendedSemester": "fall",
      "source_document": "official-required-subjects-112-b2040",
      "notes": [
        "官方必修科目表未提供英文課名，故不自行翻譯。"
      ],
      "alternatives": [],
      "manual_review_required": false
    },
    {
      "course_id": "b2040_5ec94acb3906",
      "canonical_name_zh": "微積分(二)",
      "canonical_name_en": null,
      "known_aliases": [],
      "credits": 4.0,
      "curriculumRequirement": "department_core",
      "recommendedYear": 1,
      "recommendedSemester": "spring",
      "source_document": "official-required-subjects-112-b2040",
      "notes": [
        "官方必修科目表未提供英文課名，故不自行翻譯。"
      ],
      "alternatives": [],
      "manual_review_required": false
    },
    {
      "course_id": "b2040_02b3d394d810",
      "canonical_name_zh": "線性代數(二)",
      "canonical_name_en": null,
      "known_aliases": [],
      "credits": 3.0,
      "curriculumRequirement": "department_core",
      "recommendedYear": 1,
      "recommendedSemester": "spring",
      "source_document": "official-required-subjects-112-b2040",
      "notes": [
        "官方必修科目表未提供英文課名，故不自行翻譯。"
      ],
      "alternatives": [],
      "manual_review_required": false
    },
    {
      "course_id": "b2040_5abc2f6e64ce",
      "canonical_name_zh": "計算機程式",
      "canonical_name_en": null,
      "known_aliases": [],
      "credits": 3.0,
      "curriculumRequirement": "department_core",
      "recommendedYear": 1,
      "recommendedSemester": "spring",
      "source_document": "official-required-subjects-112-b2040",
      "notes": [
        "官方必修科目表未提供英文課名，故不自行翻譯。"
      ],
      "alternatives": [],
      "manual_review_required": false
    },
    {
      "course_id": "b2040_1c04ace2dded",
      "canonical_name_zh": "高等微積分(一)",
      "canonical_name_en": null,
      "known_aliases": [],
      "credits": 4.0,
      "curriculumRequirement": "department_core",
      "recommendedYear": 2,
      "recommendedSemester": "fall",
      "source_document": "official-required-subjects-112-b2040",
      "notes": [
        "官方必修科目表未提供英文課名，故不自行翻譯。"
      ],
      "alternatives": [],
      "manual_review_required": false
    },
    {
      "course_id": "b2040_e35c1c7b7299",
      "canonical_name_zh": "機率論(一)",
      "canonical_name_en": null,
      "known_aliases": [],
      "credits": 3.0,
      "curriculumRequirement": "department_core",
      "recommendedYear": 2,
      "recommendedSemester": "fall",
      "source_document": "official-required-subjects-112-b2040",
      "notes": [
        "官方必修科目表未提供英文課名，故不自行翻譯。"
      ],
      "alternatives": [],
      "manual_review_required": false
    },
    {
      "course_id": "b2040_d43b64b75b98",
      "canonical_name_zh": "離散數學(一)",
      "canonical_name_en": null,
      "known_aliases": [],
      "credits": 3.0,
      "curriculumRequirement": "department_core",
      "recommendedYear": 2,
      "recommendedSemester": "fall",
      "source_document": "official-required-subjects-112-b2040",
      "notes": [
        "官方必修科目表未提供英文課名，故不自行翻譯。"
      ],
      "alternatives": [],
      "manual_review_required": false
    },
    {
      "course_id": "b2040_4f20b9632449",
      "canonical_name_zh": "高等微積分(二)",
      "canonical_name_en": null,
      "known_aliases": [],
      "credits": 4.0,
      "curriculumRequirement": "department_core",
      "recommendedYear": 2,
      "recommendedSemester": "spring",
      "source_document": "official-required-subjects-112-b2040",
      "notes": [
        "官方必修科目表未提供英文課名，故不自行翻譯。"
      ],
      "alternatives": [],
      "manual_review_required": false
    },
    {
      "course_id": "b2040_4576fabdcdaf",
      "canonical_name_zh": "微分方程(一)",
      "canonical_name_en": null,
      "known_aliases": [],
      "credits": 3.0,
      "curriculumRequirement": "department_core",
      "recommendedYear": 2,
      "recommendedSemester": "spring",
      "source_document": "official-required-subjects-112-b2040",
      "notes": [
        "官方必修科目表未提供英文課名，故不自行翻譯。"
      ],
      "alternatives": [],
      "manual_review_required": false
    },
    {
      "course_id": "b2040_8139113b74d2",
      "canonical_name_zh": "統計學(一)",
      "canonical_name_en": null,
      "known_aliases": [],
      "credits": 3.0,
      "curriculumRequirement": "department_core",
      "recommendedYear": 2,
      "recommendedSemester": "spring",
      "source_document": "official-required-subjects-112-b2040",
      "notes": [
        "官方必修科目表未提供英文課名，故不自行翻譯。"
      ],
      "alternatives": [],
      "manual_review_required": false
    }
  ],
  "course_groups": [],
  "prerequisites": [],
  "non_duplicated_counting_groups": [],
  "manual_review_rules": [
    {
      "rule_id": "b2040_official_table_review_pending",
      "description": "官方必修科目表已轉為結構化候選，但尚未完成逐列雙人覆核。",
      "reason": "自動解析可保存表格內容，不能單獨證明跨欄、附註與特殊身分條件已完整建模。",
      "source_document": "official-required-subjects-112-b2040",
      "resolution": "逐列對照官方表，確認課名、學分、建議學期、分組與所有附註後再改為reviewed。"
    },
    {
      "rule_id": "b2040_course_regulation_01",
      "description": "3.本系必選群組:代數學(一)、複變函數論(一)、數值分析(一),以上3門課至少選修2門課(含)以上,且成績及格取得學分。",
      "reason": "這是系所特有條款，可能包含組別、領域、授課語言、檢定、抵免或審查條件，現有課程完成狀態不足以自動證明。",
      "source_document": "official-required-subjects-112-b2040",
      "resolution": "依本條所述身分與課程屬性逐項查核；在ClearGrad尚未支援對應屬性前，不可自動標示已完成。"
    },
    {
      "rule_id": "b2040_course_regulation_02",
      "description": "4.本系專業必選修課程,不得低於67學分。",
      "reason": "這是系所特有條款，可能包含組別、領域、授課語言、檢定、抵免或審查條件，現有課程完成狀態不足以自動證明。",
      "source_document": "official-required-subjects-112-b2040",
      "resolution": "依本條所述身分與課程屬性逐項查核；在ClearGrad尚未支援對應屬性前，不可自動標示已完成。"
    },
    {
      "rule_id": "b2040_course_regulation_03",
      "description": "5.英語組修課規定:本系專業必修課程應修習全英語課程。",
      "reason": "這是系所特有條款，可能包含組別、領域、授課語言、檢定、抵免或審查條件，現有課程完成狀態不足以自動證明。",
      "source_document": "official-required-subjects-112-b2040",
      "resolution": "依本條所述身分與課程屬性逐項查核；在ClearGrad尚未支援對應屬性前，不可自動標示已完成。"
    }
  ],
  "additional_credit_rules": [
    {
      "rule_id": "b2040_foreign_secondary_grade2_equivalent",
      "admission_statuses": [
        "國外或香港澳門地區同級同類學校畢業年級相當於國內高級中等學校二年級，並以同等學力入學"
      ],
      "additional_credits": 12,
      "source_document": "official-required-subjects-112-b2040",
      "notes": [
        "官方修課規定明載在原訂畢業應修學分之外增加12學分。"
      ]
    }
  ]
}
