{
  "schema_version": "1.0",
  "rule_set_id": "nsysu-112-bachelor-B7610",
  "rule_type": "department",
  "entry_year": "112",
  "degree_level": "bachelor",
  "department_code": "B7610",
  "department_name_zh": "人文暨科技跨領域學士學位學程",
  "department_name_en": null,
  "common_rule_ref": null,
  "review_status": "manual_review_required",
  "reviewed_at": "2026-08-22",
  "coverage": "partial",
  "credit_requirements": {
    "minimum_graduation_credits": 128,
    "minimum_required_credits": null,
    "minimum_elective_credits": null,
    "minimum_department_elective_credits": null,
    "minimum_department_professional_credits": null
  },
  "sources": [
    {
      "source_id": "official-required-subjects-112-b7610",
      "title": "國立中山大學必修科目表（112學年度入學新生適用）－人文暨科技跨領域學士學位學程",
      "url": "https://selcrs.nsysu.edu.tw/stu_query/crs_mst_qry/crs_mst_query.asp?action=3&YY1=112&DPT1=B7610",
      "document_type": "html",
      "reviewed_at": "2026-08-22",
      "sha256": "48d59131016dd2333e73e8e2ea04f7cbf7f42990a7a9737d19cda3373ae9e714"
    }
  ],
  "courses": [
    {
      "course_id": "b7610_24c4a96e5f16",
      "canonical_name_zh": "科技創新趨勢與需求探索",
      "canonical_name_en": null,
      "known_aliases": [],
      "credits": 3.0,
      "curriculumRequirement": "department_core",
      "recommendedYear": 1,
      "recommendedSemester": "fall",
      "source_document": "official-required-subjects-112-b7610",
      "notes": [
        "官方必修科目表未提供英文課名，故不自行翻譯。"
      ],
      "alternatives": [],
      "manual_review_required": false
    },
    {
      "course_id": "b7610_1d22d5eed1ed",
      "canonical_name_zh": "文化人類學",
      "canonical_name_en": null,
      "known_aliases": [],
      "credits": 3.0,
      "curriculumRequirement": "department_core",
      "recommendedYear": 1,
      "recommendedSemester": "fall",
      "source_document": "official-required-subjects-112-b7610",
      "notes": [
        "官方必修科目表未提供英文課名，故不自行翻譯。"
      ],
      "alternatives": [],
      "manual_review_required": false
    },
    {
      "course_id": "b7610_61a84d027f27",
      "canonical_name_zh": "基礎程式應用",
      "canonical_name_en": null,
      "known_aliases": [],
      "credits": 3.0,
      "curriculumRequirement": "department_core",
      "recommendedYear": 1,
      "recommendedSemester": "fall",
      "source_document": "official-required-subjects-112-b7610",
      "notes": [
        "官方必修科目表未提供英文課名，故不自行翻譯。"
      ],
      "alternatives": [],
      "manual_review_required": false
    },
    {
      "course_id": "b7610_1e616eef7bf1",
      "canonical_name_zh": "設計溝通與表達",
      "canonical_name_en": null,
      "known_aliases": [],
      "credits": 3.0,
      "curriculumRequirement": "department_core",
      "recommendedYear": 1,
      "recommendedSemester": "spring",
      "source_document": "official-required-subjects-112-b7610",
      "notes": [
        "官方必修科目表未提供英文課名，故不自行翻譯。"
      ],
      "alternatives": [],
      "manual_review_required": false
    },
    {
      "course_id": "b7610_cd2b57c0fe01",
      "canonical_name_zh": "創客基礎",
      "canonical_name_en": null,
      "known_aliases": [],
      "credits": 3.0,
      "curriculumRequirement": "department_core",
      "recommendedYear": 1,
      "recommendedSemester": "spring",
      "source_document": "official-required-subjects-112-b7610",
      "notes": [
        "官方必修科目表未提供英文課名，故不自行翻譯。"
      ],
      "alternatives": [],
      "manual_review_required": false
    },
    {
      "course_id": "b7610_0d0ba0d5632a",
      "canonical_name_zh": "當代社會問題與創新案例研究",
      "canonical_name_en": null,
      "known_aliases": [],
      "credits": 3.0,
      "curriculumRequirement": "department_core",
      "recommendedYear": 1,
      "recommendedSemester": "spring",
      "source_document": "official-required-subjects-112-b7610",
      "notes": [
        "官方必修科目表未提供英文課名，故不自行翻譯。"
      ],
      "alternatives": [],
      "manual_review_required": false
    },
    {
      "course_id": "b7610_38718f9809dc",
      "canonical_name_zh": "跨領域探索",
      "canonical_name_en": null,
      "known_aliases": [],
      "credits": 1.0,
      "curriculumRequirement": "department_core",
      "recommendedYear": 2,
      "recommendedSemester": "fall",
      "source_document": "official-required-subjects-112-b7610",
      "notes": [
        "官方必修科目表未提供英文課名，故不自行翻譯。"
      ],
      "alternatives": [],
      "manual_review_required": false
    },
    {
      "course_id": "b7610_14d2f01126f2",
      "canonical_name_zh": "設計思考",
      "canonical_name_en": null,
      "known_aliases": [],
      "credits": 3.0,
      "curriculumRequirement": "department_core",
      "recommendedYear": 2,
      "recommendedSemester": "fall",
      "source_document": "official-required-subjects-112-b7610",
      "notes": [
        "官方必修科目表未提供英文課名，故不自行翻譯。"
      ],
      "alternatives": [],
      "manual_review_required": false
    },
    {
      "course_id": "b7610_3393dc9a005c",
      "canonical_name_zh": "科學應用",
      "canonical_name_en": null,
      "known_aliases": [],
      "credits": 3.0,
      "curriculumRequirement": "department_core",
      "recommendedYear": 2,
      "recommendedSemester": "fall",
      "source_document": "official-required-subjects-112-b7610",
      "notes": [
        "官方必修科目表未提供英文課名，故不自行翻譯。"
      ],
      "alternatives": [],
      "manual_review_required": false
    },
    {
      "course_id": "b7610_a7c5f12b3b0f",
      "canonical_name_zh": "基礎研究方法",
      "canonical_name_en": null,
      "known_aliases": [],
      "credits": 3.0,
      "curriculumRequirement": "department_core",
      "recommendedYear": 2,
      "recommendedSemester": "spring",
      "source_document": "official-required-subjects-112-b7610",
      "notes": [
        "官方必修科目表未提供英文課名，故不自行翻譯。"
      ],
      "alternatives": [],
      "manual_review_required": false
    },
    {
      "course_id": "b7610_f13ab0fe6999",
      "canonical_name_zh": "跨領域創新專題(一)",
      "canonical_name_en": null,
      "known_aliases": [],
      "credits": 3.0,
      "curriculumRequirement": "department_core",
      "recommendedYear": 2,
      "recommendedSemester": "spring",
      "source_document": "official-required-subjects-112-b7610",
      "notes": [
        "官方必修科目表未提供英文課名，故不自行翻譯。"
      ],
      "alternatives": [],
      "manual_review_required": false
    },
    {
      "course_id": "b7610_858b300d119e",
      "canonical_name_zh": "跨領域創新專題(二)",
      "canonical_name_en": null,
      "known_aliases": [],
      "credits": 3.0,
      "curriculumRequirement": "department_core",
      "recommendedYear": 3,
      "recommendedSemester": "fall",
      "source_document": "official-required-subjects-112-b7610",
      "notes": [
        "官方必修科目表未提供英文課名，故不自行翻譯。"
      ],
      "alternatives": [],
      "manual_review_required": false
    },
    {
      "course_id": "b7610_be8b9cace50a",
      "canonical_name_zh": "創新設計或創業專題(一)",
      "canonical_name_en": null,
      "known_aliases": [],
      "credits": 3.0,
      "curriculumRequirement": "department_core",
      "recommendedYear": 3,
      "recommendedSemester": "spring",
      "source_document": "official-required-subjects-112-b7610",
      "notes": [
        "官方必修科目表未提供英文課名，故不自行翻譯。"
      ],
      "alternatives": [],
      "manual_review_required": false
    },
    {
      "course_id": "b7610_b3aa496a8f53",
      "canonical_name_zh": "創新設計或創業專題研討",
      "canonical_name_en": null,
      "known_aliases": [],
      "credits": 3.0,
      "curriculumRequirement": "department_core",
      "recommendedYear": 4,
      "recommendedSemester": "fall",
      "source_document": "official-required-subjects-112-b7610",
      "notes": [
        "官方必修科目表未提供英文課名，故不自行翻譯。"
      ],
      "alternatives": [],
      "manual_review_required": false
    }
  ],
  "course_groups": [],
  "prerequisites": [],
  "non_duplicated_counting_groups": [],
  "manual_review_rules": [
    {
      "rule_id": "b7610_official_table_review_pending",
      "description": "官方必修科目表已轉為結構化候選，但尚未完成逐列雙人覆核。",
      "reason": "自動解析可保存表格內容，不能單獨證明跨欄、附註與特殊身分條件已完整建模。",
      "source_document": "official-required-subjects-112-b7610",
      "resolution": "逐列對照官方表，確認課名、學分、建議學期、分組與所有附註後再改為reviewed。"
    },
    {
      "rule_id": "b7610_course_regulation_01",
      "description": "3.跨領域學程(整合學程或微學程)之學程內容、最低修習學分數、及學分取得方式等依各學程修課規定辦理。",
      "reason": "這是系所特有條款，可能包含組別、領域、授課語言、檢定、抵免或審查條件，現有課程完成狀態不足以自動證明。",
      "source_document": "official-required-subjects-112-b7610",
      "resolution": "依本條所述身分與課程屬性逐項查核；在ClearGrad尚未支援對應屬性前，不可自動標示已完成。"
    }
  ],
  "additional_credit_rules": []
}
